{
  "$schema": "https://json-schema.org/draft/2020-12/schema",
  "title": "A/B event envelope, schemaVersion 1",
  "type": "object",
  "additionalProperties": false,
  "required": [
    "eventId",
    "eventType",
    "schemaVersion",
    "producer",
    "occurredAt",
    "source",
    "channel",
    "payload"
  ],
  "properties": {
    "eventId": {
      "$ref": "#/$defs/id"
    },
    "eventType": {
      "enum": [
        "PRODUCT_SNAPSHOT_CHANGED",
        "PAYMENT_SUCCEEDED",
        "REFUND_STATUS_CHANGED",
        "TEAM_COMPLETED",
        "TEAM_RECONCILIATION_REQUIRED",
        "TEAM_FAILED",
        "EVENT_PROCESSING_RESULT"
      ]
    },
    "schemaVersion": {
      "const": 1,
      "type": "integer"
    },
    "producer": {
      "$ref": "#/$defs/id"
    },
    "occurredAt": {
      "$ref": "#/$defs/time"
    },
    "source": {
      "$ref": "#/$defs/scope"
    },
    "channel": {
      "$ref": "#/$defs/scope"
    },
    "correlationId": {
      "anyOf": [
        {
          "$ref": "#/$defs/id"
        },
        {
          "type": "null"
        }
      ]
    },
    "payload": {
      "type": "object"
    }
  },
  "allOf": [
    {
      "if": {
        "properties": {
          "eventType": {
            "const": "PRODUCT_SNAPSHOT_CHANGED"
          }
        }
      },
      "then": {
        "properties": {
          "payload": {
            "$ref": "#/$defs/ProductSnapshotChanged"
          }
        }
      }
    },
    {
      "if": {
        "properties": {
          "eventType": {
            "const": "PAYMENT_SUCCEEDED"
          }
        }
      },
      "then": {
        "properties": {
          "payload": {
            "$ref": "#/$defs/PaymentSucceeded"
          }
        }
      }
    },
    {
      "if": {
        "properties": {
          "eventType": {
            "const": "REFUND_STATUS_CHANGED"
          }
        }
      },
      "then": {
        "properties": {
          "payload": {
            "$ref": "#/$defs/RefundStatusChanged"
          }
        }
      }
    },
    {
      "if": {
        "properties": {
          "eventType": {
            "const": "TEAM_COMPLETED"
          }
        }
      },
      "then": {
        "properties": {
          "payload": {
            "$ref": "#/$defs/TeamCompleted"
          }
        }
      }
    },
    {
      "if": {
        "properties": {
          "eventType": {
            "const": "TEAM_RECONCILIATION_REQUIRED"
          }
        }
      },
      "then": {
        "properties": {
          "payload": {
            "$ref": "#/$defs/TeamReconciliationRequired"
          }
        }
      }
    },
    {
      "if": {
        "properties": {
          "eventType": {
            "const": "TEAM_FAILED"
          }
        }
      },
      "then": {
        "properties": {
          "payload": {
            "$ref": "#/$defs/TeamFailed"
          }
        }
      }
    },
    {
      "if": {
        "properties": {
          "eventType": {
            "const": "EVENT_PROCESSING_RESULT"
          }
        }
      },
      "then": {
        "properties": {
          "payload": {
            "$ref": "#/$defs/EventProcessingResultPayload"
          }
        }
      }
    }
  ],
  "$defs": {
    "id": {
      "type": "string",
      "minLength": 1,
      "maxLength": 64,
      "pattern": "^\\S(?:.*\\S)?$(?![\\s\\S])"
    },
    "scope": {
      "type": "string",
      "minLength": 1,
      "maxLength": 8,
      "pattern": "^\\S(?:.*\\S)?$(?![\\s\\S])"
    },
    "time": {
      "type": "string",
      "format": "date-time",
      "pattern": "^\\d{4}-\\d{2}-\\d{2}T\\d{2}:\\d{2}:\\d{2}\\.\\d{3}Z$(?![\\s\\S])"
    },
    "money": {
      "type": "string",
      "pattern": "^(0|[1-9][0-9]{0,5})\\.[0-9]{2}$(?![\\s\\S])"
    },
    "positiveMoney": {
      "allOf": [
        {
          "$ref": "#/$defs/money"
        },
        {
          "not": {
            "const": "0.00"
          }
        }
      ]
    },
    "positiveLong": {
      "type": "string",
      "maxLength": 19,
      "pattern": "^(?:[1-9][0-9]{0,17}|[1-8][0-9]{18}|9[0-1][0-9]{17}|92[0-1][0-9]{16}|922[0-2][0-9]{15}|9223[0-2][0-9]{14}|92233[0-6][0-9]{13}|922337[0-1][0-9]{12}|92233720[0-2][0-9]{10}|922337203[0-5][0-9]{9}|9223372036[0-7][0-9]{8}|92233720368[0-4][0-9]{7}|922337203685[0-3][0-9]{6}|9223372036854[0-6][0-9]{5}|92233720368547[0-6][0-9]{4}|922337203685477[0-4][0-9]{3}|9223372036854775[0-7][0-9]{2}|922337203685477580[0-6][0-9]{0}|9223372036854775807)$(?![\\s\\S])"
    },
    "ProductSnapshotChanged": {
      "type": "object",
      "additionalProperties": false,
      "properties": {
        "goodsId": {
          "$ref": "#/$defs/id"
        },
        "productVersion": {
          "$ref": "#/$defs/positiveLong"
        },
        "goodsName": {
          "type": "string",
          "minLength": 1,
          "maxLength": 128
        },
        "originalPrice": {
          "$ref": "#/$defs/positiveMoney"
        },
        "currency": {
          "const": "CNY"
        },
        "saleStatus": {
          "enum": [
            "ON_SALE",
            "OFF_SALE"
          ]
        }
      },
      "required": [
        "goodsId",
        "productVersion",
        "goodsName",
        "originalPrice",
        "currency",
        "saleStatus"
      ]
    },
    "PaymentSucceeded": {
      "type": "object",
      "additionalProperties": false,
      "properties": {
        "userId": {
          "$ref": "#/$defs/id"
        },
        "outTradeNo": {
          "$ref": "#/$defs/id"
        },
        "paymentId": {
          "$ref": "#/$defs/id"
        },
        "paidAmount": {
          "$ref": "#/$defs/positiveMoney"
        },
        "currency": {
          "const": "CNY"
        },
        "paidAt": {
          "$ref": "#/$defs/time"
        }
      },
      "required": [
        "userId",
        "outTradeNo",
        "paymentId",
        "paidAmount",
        "currency",
        "paidAt"
      ]
    },
    "RefundStatusChanged": {
      "type": "object",
      "additionalProperties": false,
      "properties": {
        "userId": {
          "$ref": "#/$defs/id"
        },
        "outTradeNo": {
          "$ref": "#/$defs/id"
        },
        "paymentId": {
          "$ref": "#/$defs/id"
        },
        "refundId": {
          "$ref": "#/$defs/id"
        },
        "refundAmount": {
          "$ref": "#/$defs/positiveMoney"
        },
        "currency": {
          "const": "CNY"
        },
        "refundStatus": {
          "enum": [
            "PENDING",
            "FAILED",
            "SUCCEEDED"
          ]
        },
        "refundVersion": {
          "$ref": "#/$defs/positiveLong"
        },
        "occurredAt": {
          "$ref": "#/$defs/time"
        },
        "failureCode": {
          "anyOf": [
            {
              "type": "string"
            },
            {
              "type": "null"
            }
          ]
        },
        "paidAt": {
          "anyOf": [
            {
              "$ref": "#/$defs/time"
            },
            {
              "type": "null"
            }
          ]
        },
        "paidAmount": {
          "anyOf": [
            {
              "$ref": "#/$defs/positiveMoney"
            },
            {
              "type": "null"
            }
          ]
        }
      },
      "required": [
        "userId",
        "outTradeNo",
        "paymentId",
        "refundId",
        "refundAmount",
        "currency",
        "refundStatus",
        "refundVersion",
        "occurredAt"
      ]
    },
    "TeamCompleted": {
      "type": "object",
      "additionalProperties": false,
      "properties": {
        "teamId": {
          "$ref": "#/$defs/id"
        },
        "activityId": {
          "$ref": "#/$defs/positiveLong"
        },
        "teamVersion": {
          "$ref": "#/$defs/positiveLong"
        },
        "outTradeNoList": {
          "type": "array",
          "maxItems": 100,
          "uniqueItems": true,
          "items": {
            "$ref": "#/$defs/id"
          }
        }
      },
      "required": [
        "teamId",
        "activityId",
        "teamVersion",
        "outTradeNoList"
      ]
    },
    "TeamReconciliationRequired": {
      "type": "object",
      "additionalProperties": false,
      "properties": {
        "teamId": {
          "$ref": "#/$defs/id"
        },
        "activityId": {
          "$ref": "#/$defs/positiveLong"
        },
        "teamVersion": {
          "$ref": "#/$defs/positiveLong"
        },
        "outTradeNoList": {
          "type": "array",
          "maxItems": 100,
          "uniqueItems": true,
          "items": {
            "$ref": "#/$defs/id"
          }
        },
        "reconciliationId": {
          "$ref": "#/$defs/id"
        },
        "rosterVersion": {
          "$ref": "#/$defs/id"
        },
        "validEndTime": {
          "$ref": "#/$defs/time"
        }
      },
      "required": [
        "teamId",
        "activityId",
        "teamVersion",
        "outTradeNoList",
        "reconciliationId",
        "rosterVersion",
        "validEndTime"
      ]
    },
    "TeamFailed": {
      "type": "object",
      "additionalProperties": false,
      "properties": {
        "teamId": {
          "$ref": "#/$defs/id"
        },
        "activityId": {
          "$ref": "#/$defs/positiveLong"
        },
        "teamVersion": {
          "$ref": "#/$defs/positiveLong"
        },
        "outTradeNoList": {
          "type": "array",
          "maxItems": 100,
          "uniqueItems": true,
          "items": {
            "$ref": "#/$defs/id"
          }
        },
        "reconciliationId": {
          "$ref": "#/$defs/id"
        },
        "reason": {
          "type": "string"
        },
        "refundRequiredOutTradeNoList": {
          "type": "array",
          "maxItems": 100,
          "uniqueItems": true,
          "items": {
            "$ref": "#/$defs/id"
          }
        }
      },
      "required": [
        "teamId",
        "activityId",
        "teamVersion",
        "outTradeNoList",
        "reconciliationId",
        "reason",
        "refundRequiredOutTradeNoList"
      ]
    },
    "EventProcessingResultPayload": {
      "type": "object",
      "additionalProperties": false,
      "properties": {
        "originalEventId": {
          "$ref": "#/$defs/id"
        },
        "originalEventType": {
          "enum": [
            "PRODUCT_SNAPSHOT_CHANGED",
            "PAYMENT_SUCCEEDED",
            "REFUND_STATUS_CHANGED"
          ]
        },
        "outcome": {
          "enum": [
            "APPLIED",
            "IGNORED",
            "REJECTED"
          ]
        },
        "code": {
          "type": "string",
          "minLength": 1
        },
        "info": {
          "type": "string"
        },
        "processedAt": {
          "$ref": "#/$defs/time"
        },
        "result": {
          "type": [
            "object",
            "null"
          ]
        }
      },
      "required": [
        "originalEventId",
        "originalEventType",
        "outcome",
        "code",
        "info",
        "processedAt",
        "result"
      ],
      "allOf": [
        {
          "if": {
            "properties": {
              "outcome": {
                "const": "REJECTED"
              }
            }
          },
          "then": {
            "properties": {
              "result": {
                "type": "null"
              },
              "code": {
                "not": {
                  "const": "0000"
                }
              }
            }
          },
          "else": {
            "properties": {
              "code": {
                "const": "0000"
              }
            }
          }
        },
        {
          "if": {
            "properties": {
              "originalEventType": {
                "const": "PRODUCT_SNAPSHOT_CHANGED"
              },
              "outcome": {
                "enum": [
                  "APPLIED",
                  "IGNORED"
                ]
              }
            }
          },
          "then": {
            "properties": {
              "result": {
                "$ref": "#/$defs/ProductProcessingResult"
              }
            }
          }
        },
        {
          "if": {
            "properties": {
              "originalEventType": {
                "const": "PAYMENT_SUCCEEDED"
              },
              "outcome": {
                "enum": [
                  "APPLIED",
                  "IGNORED"
                ]
              }
            }
          },
          "then": {
            "properties": {
              "result": {
                "$ref": "#/$defs/PaymentProcessingResult"
              }
            }
          }
        },
        {
          "if": {
            "properties": {
              "originalEventType": {
                "const": "REFUND_STATUS_CHANGED"
              },
              "outcome": {
                "enum": [
                  "APPLIED",
                  "IGNORED"
                ]
              }
            }
          },
          "then": {
            "properties": {
              "result": {
                "$ref": "#/$defs/RefundProcessingResult"
              }
            }
          }
        },
        {
          "if": {
            "properties": {
              "originalEventType": {
                "const": "PRODUCT_SNAPSHOT_CHANGED"
              },
              "outcome": {
                "const": "APPLIED"
              }
            }
          },
          "then": {
            "properties": {
              "result": {
                "properties": {
                  "applied": {
                    "const": true
                  }
                }
              }
            }
          }
        },
        {
          "if": {
            "properties": {
              "originalEventType": {
                "const": "PRODUCT_SNAPSHOT_CHANGED"
              },
              "outcome": {
                "const": "IGNORED"
              }
            }
          },
          "then": {
            "properties": {
              "result": {
                "properties": {
                  "applied": {
                    "const": false
                  }
                }
              }
            }
          }
        }
      ]
    },
    "AcceptedPayment": {
      "type": "object",
      "additionalProperties": false,
      "properties": {
        "paymentId": {
          "$ref": "#/$defs/id"
        },
        "paidAmount": {
          "$ref": "#/$defs/positiveMoney"
        },
        "currency": {
          "const": "CNY"
        },
        "paidAt": {
          "$ref": "#/$defs/time"
        }
      },
      "required": [
        "paymentId",
        "paidAmount",
        "currency",
        "paidAt"
      ]
    },
    "PaymentProcessingResult": {
      "type": "object",
      "additionalProperties": false,
      "properties": {
        "orderId": {
          "$ref": "#/$defs/id"
        },
        "outTradeNo": {
          "$ref": "#/$defs/id"
        },
        "teamId": {
          "$ref": "#/$defs/id"
        },
        "payment": {
          "$ref": "#/$defs/AcceptedPayment"
        },
        "orderStatus": {
          "const": "PAID"
        },
        "teamStatus": {
          "enum": [
            "FORMING",
            "RECONCILING",
            "COMPLETED",
            "FAILED"
          ]
        },
        "recordVersion": {
          "$ref": "#/$defs/positiveLong"
        },
        "teamVersion": {
          "$ref": "#/$defs/positiveLong"
        }
      },
      "required": [
        "orderId",
        "outTradeNo",
        "teamId",
        "payment",
        "orderStatus",
        "teamStatus",
        "recordVersion",
        "teamVersion"
      ]
    },
    "ProductProcessingResult": {
      "type": "object",
      "additionalProperties": false,
      "properties": {
        "goodsId": {
          "$ref": "#/$defs/id"
        },
        "currentVersion": {
          "$ref": "#/$defs/positiveLong"
        },
        "applied": {
          "type": "boolean"
        },
        "saleStatus": {
          "enum": [
            "ON_SALE",
            "OFF_SALE"
          ]
        }
      },
      "required": [
        "goodsId",
        "currentVersion",
        "applied",
        "saleStatus"
      ]
    },
    "RefundProcessingResult": {
      "type": "object",
      "additionalProperties": false,
      "properties": {
        "outTradeNo": {
          "$ref": "#/$defs/id"
        },
        "refundId": {
          "$ref": "#/$defs/id"
        },
        "refundStatus": {
          "enum": [
            "PENDING",
            "FAILED",
            "SUCCEEDED"
          ]
        },
        "refundVersion": {
          "$ref": "#/$defs/positiveLong"
        },
        "recordVersion": {
          "$ref": "#/$defs/positiveLong"
        }
      },
      "required": [
        "outTradeNo",
        "refundId",
        "refundStatus",
        "refundVersion",
        "recordVersion"
      ]
    }
  }
}
